id,name,date_created,active,creator_id,is_public,prep_time,instructions,photo_link,cookbook,cookbook_page_number,web_link,category_id,type_id
1,"Peanut Butter and Jelly Sandwich",2019-11-14,1,1,1,5,"1. Spread peanut butter onto one piece of bread. 2. Spread jelly onto a second piece of bread. 3. Combine and enjoy.",https://tmbidigitalassetsazure.blob.core.windows.net/secure/RMS/attachments/37/1200x1200/Peanut-Butter-and-Jelly-French-Toast_EXPS_BMZ19_526_B12_04_10b.jpg,"The Bachelor’s Cookbook",1,,3,2
2,"Spaghetti ",2019-11-14,1,1,1,20,"1. Boil noodles for 8 minutes and drain. 2. Pour spaghetti sauce into a pot and warm 3. Combine and eat.",https://www.inspiredtaste.net/wp-content/uploads/2019/03/Spaghetti-with-Meat-Sauce-Recipe-3-1200.jpg,"The Bachelor’s Cookbook",2,,4,3
3,"Buttered Toast",2019-11-14,1,1,1,3,"1. Place a slice of bread into the toaster & toast to desired crispness. 2. Remove and spread a layer of butter onto the toast. 3. Eat",https://cdn-image.myrecipes.com/sites/default/files/styles/pronto_crop_large/public/assets%252Fmessage-editor%252F1467176631211-diner-toast-knife-inline_0.jpg,"The Bachelor’s Cookbook",3,,3,1
4,Pizza,2019-11-14,1,1,1,20,"1. Spread pizza sauce onto pizza crust. 2. Add mozzarella cheese. 3. Cook in the oven at 375 for 20 minutes. 4. Remove and cool for 5 minutes. 5. Slice and chow down.",https://i.iheart.com/v3/re/new_assets/5d710bf67e5b163a524c72b2,"The Bachelor’s Cookbook",4,,4,3
5,Ramen,2019-11-14,1,1,1,5,"1. Boil ramen in a pot of water for 3-5 minutes. 2. Add seasoning 3. Allow to cool to desired temperature and enjoy.",https://images-na.ssl-images-amazon.com/images/I/915AEp17FaL._SL1500_.jpg,"The Bachelor’s Cookbook",5,,2,3
6,"Banana Cake",2019-11-20,1,1,1,300,"Bake in three layer pans at 350 degrees.",https://hips.hearstapps.com/vidthumb/images/delish-banana-cake-4-1535137229.jpg,,,,1,5
7,"Blueberry Coffee Cake",2019-11-19,1,1,1,50,"Mix butter; 1 cup sugar; flour; 2 eggs; 2 tsp vanilla; baking powder; and milk to make cake batter. Blend easily.  Add 3 cups of blueberries.  Put 2 1/2 cups of batter in pan. Mix cream cheese; 1/2 cup sugar; 1 egg; lemon juice and 1 tsp vanilla to make filling.  Put filling on top of batter.  Top with remaining batter. Make streusel topping from flour; butter; brown sugar; ad cinnamon.  Sprinkle on top of cake. Bake at 375 degrees for 1 hour and 5 minutes.  Check after 50 minutes.",https://www.lifeloveandsugar.com/wp-content/uploads/2015/08/Blueberry_Coffee_Cake.jpg,,,,4,5
8,"Chocolate Cake",2019-11-19,1,1,1,50,"Mix all ingredients together.  Pour in 1 cup boiling water.  Mix well.  Bake about 35 minutes at 375 degrees.",https://cdn-image.foodandwine.com/sites/default/files/1532533774/moms-chocolate-cake-XL-RECIPE0918.jpg,,,,3,5
9,"Crazy Cake",2019-11-19,1,1,1,40,"Mix first 5 ingredients well; about 4 minutes.  Bake at 350 degrees in a 9x13 pan for 35 minutes. Poke holes in warm cake and pour on mixture of powdered sugar and lemon juice.",https://live.staticflickr.com/3503/3826356525_d5f0a3b59c_m.jpg,,,,3,5
10,"Fresh Apple Cake",2019-11-19,1,1,1,70,"Mix apples and sugar well.  Add oil; nuts; and eggs.  Add vanilla and dry ingredients.  Bake at 350 degrees for 40-45 minutes.  Serve with whipped cream or top with cream cheese frosting.",https://www.onceuponachef.com/images/2011/04/French-Apple-Cake-760x943.jpg,,,,3,5
11,"Blue Chip Cookies",2019-11-19,1,1,1,25,"Mix at low speed.  Add chocolate chips and nuts by hand.  Press into balls in cookie scoop.  Bake at 300 degrees for 15 minutes on middle rack.",https://pbs.twimg.com/media/B__wt5AWsAAjXZn.jpg,,,,3,5
12,"Bourbon Balls",2019-11-19,1,1,1,75,"Melt chocolate in double boiler over hot water.  Combine syrup and liquid.  Combine crumbs; sugar; and nuts.  Add chocolate mixture.  Let stand 30 minutes.  Shape in 1",https://www.loveandoliveoil.com/wp-content/uploads/2017/04/bourbon-delightH2.jpg,,,,4,5
13,"Chocolate Crisp Bran Cookies",2019-11-19,1,1,1,15,"Sift flour; soda; and salt.  Blend butter and sugar.  Add eggs and vanilla; beat well.  Add All-Bran cereal and chocolate chips.  Add dry ingredients; mix well.  Drop by spoonful onto cookie sheet.  Bake at 375 degrees about 12 minutes.",https://amyshealthybaking.com/wp-content/uploads/2019/01/ultimate-healthy-crunchy-chocolate-chip-cookies-5617.jpg,,,,8,5
14,"Chocolate Peanut Brunch Bars",2019-11-19,1,1,1,30,"Blend first 5 ingredients until it resembles corn meal.  Add egg and vanilla.  Mix well.  Press firmly into ungreased jelly roll pan.  Bake at 350 degrees for 25 minutes.  Cool slightly.  Melt chocolate over hot water.  Stir in peanut butter and cereal.  Spread on cookie dough.  Let stand until chocolate sets.  Cut into 35 bars.",https://beamingbaker.com/wp-content/uploads/2016/09/Peanut-Butter-Chocolate-Chip-Oatmeal-Breakfast-Bars-Vegan-Gluten-Free-Dairy-Free-1.jpg,,,,5,5
15,"Chocolate Trio Squares",2019-11-19,1,1,1,25,"Cream butter; mis in four; and salt.  Spread in greased and floured 9",https://thesweetestoccasion.com/wp-content/uploads/2016/11/dark-chocolate-caramel-corn-fudge-16.jpg,,,,4,5
16,"Broccoli Curry Salad",2019-11-19,1,1,1,20,"Mix all ingredients and enjoy",http://eatinmess.com.au/wp-content/uploads/2015/07/curry-broccoli-salad.jpg,,,,7,2
17,"Broccoli Salad",2019-11-19,1,1,1,15,"Pour dressing over salad two hours before serving.",https://www.fifteenspatulas.com/wp-content/uploads/2014/01/Broccoli-Salad-Fifteen-Spatulas-7-500x427.jpg,,,,4,2
18,"Five Cup Salad",2019-11-19,1,1,1,15,"Combine all ingredients.  Chill overnight.",https://images.media-allrecipes.com/userphotos/560x315/4503262.jpg,,,,3,5
19,"Chicken Noodle Soup",2019-11-20,1,1,1,25,"Boil chicken; remove from bones and chop.  Set aside.  Cook potato; carrots; celery; and onion in water to cover.  When tender add the chicken; bouillon cubes; poultry seasoning; and salt.  Add a large handful of narrow egg noodles.  Add more liquid if necessary and cook until noodles are tender.",https://hips.hearstapps.com/del.h-cdn.co/assets/17/38/1506010321-chicken-noodle-soup-delish-1.jpg,,,,3,3
20,"Cleo's Clam Chowder",2019-11-20,1,1,1,45,"Boil potatoes.  Save water.  When potatoes are tender add bacon; onion; and celery.  Add half and half; milk and seasonings.  Thicken with a cup of flour mixed with water.  Add to boiling soup.  Stir in clams; but not too soon or they will get tough.",https://pbs.twimg.com/media/DW4U02VVoAALjjL.jpg,,,,7,3
21,"Creamy Zucchini Mushroom Soup",2019-11-20,1,1,1,25,"Combine zucchini; onion; garlic and butter in 2 qt. microwave-safe casserole.  Cover and microwave on high setting 5 to 7 minutes; stirring every 3 minutes; until vegetables are tender.  Place zucchini mixture in blender container; blend until smooth.  Return to casserole dish; add all remaining ingredients except sour cream; pepper and pine nuts.  Cover and microwave 5 to 6 minutes; or until heated through.  Stir in sour cream and season to taste with pepper.  Ladle into soup bowls and garnish with sprinkle of pine nuts.  Serve immediately.",https://tastespace.files.wordpress.com/2010/10/dsc_2730-1porn-e1437695416979.jpg,,,,7,2
22,"Elephant Stew",2019-11-20,1,1,1,85,"Cut elephant into bite-size pieces.  (Allow approximately 12 months.)  Add enough gravy to cover.  Cook over kerosene fire for 4 weeks at 463 degrees.  Makes 3;300 servings.  To extend recipe add rabbits; but only if necessary; as some people do not like to find hare in their stew. Brown the meat; then add all of the ingredients; except the cabbage. Cover with water and simmer for about an hour until veggies are tender.  Then add the chopped cabbage and simmer again for about a half hour.  Add more liquid if necessary.",https://s3-media3.fl.yelpcdn.com/bphoto/TpezzGrKBXJkzjR-8cl48A/o.jpg,,,,3,3
23,"Minestrone Soup",2019-11-20,1,1,1,45,"Brown hamburger and onions.  Add all other ingredients with enough water to cover.  Simmer two to three hours then add spaghetti and cook until tender.",https://cookieandkate.com/images/2018/01/best-minestrone-soup-recipe.jpg,,,,5,2
24,"Chinese Fried Rice",2019-11-20,1,1,1,25,"Saute onion and meat in oil. Add other ingredients except egg. Cook on low heat about 15 to 20 minutes. Beat egg with a tablespoon of milk. Melt butter in skillet; pour in egg and cook until solid. Slice in thin strips to put over the rice as garnish on the platter.",https://www.jessicagavin.com/wp-content/uploads/2018/09/fried-rice-8-1200.jpg,,,,2,3
25,"Pork Fu Man Chow",2019-11-20,1,1,1,15,"Saute onion and celery in oil. Add pork; bean sprouts and all other ingredients except peas and noodles. Simmer for 30 minutes. Add peas and simmer for 30 more minutes. Serve over noodles.",https://upload.wikimedia.org/wikipedia/commons/d/d1/Chow_mein_1_by_yuen.jpg,,,,2,3
26,"Shrimp Pineapple Fried Rice",2019-11-20,1,1,1,30,"Fry cooled rice in oil in a skillet. Add shrimp; onions and pineapple. Add soy sauce to taste.",https://d1doqjmisr497k.cloudfront.net/-/media/mccormick-us/recipes/mccormick/t/800/thai_pineapple_fried_rice_recipes_800x800.jpg,,,,2,3
27,"Sweet and Sour Pork",2019-11-20,1,1,1,25,"Cut pork into chunks. Marinade for 30 minutes in dressing made by combining: salt; soy sauce; cornstarch; and water. Drain pork and dip in a batter of coating mix; ice water; and egg. Brown in a few tablespoons of oil in a wok about 3 minutes or until brown and crisp. Remove with a slotted spoon. Add green pepper; onion; and carrot. Stir fry about 5 minutes. Add sweet and sour sauce made by combining: ketchup; brown sugar; white sugar; cinnamon; ginger; and juice of the large lemon. Stir until sauce thickens. Add pineapple chunks and the pork. Ser with hot steamed rice.",https://pupswithchopsticks.com/wp-content/uploads/sweet-and-sour-pork-thumbnail-1.jpg,,,,2,2
28,"Albert's Chicken",2019-11-20,1,1,1,25,"Place chicken in casserole. Heat together remaining ingredients to make sauce. Pour sauce over chicken. Cook in electric skillet or 350 degree oven for about 1 hour.",https://www.onceuponachef.com/images/2016/09/Spicy-Honey-Roast-Chicken-1-760x550.jpg,,,,3,2
29,"Avocado Chicken Melt",2019-11-20,1,1,1,46,"Using a meat mallet and a hard surface; pound the chicken to 1/4 inch thickness. Mix together the cornstarch; cumin and garlic salt. Add the chicken 1 piece at a time; dredging to coat. Mix the egg and water in a small bowl. Put the cornmeal in another small bowl. Dip the chicken first in the egg wash and then in the cornmeal; turning to coat. Heat the oil in a large frying pan until hot. Add the chicken and cook for 2 minutes on each side. Remove the chicken to a shallow baking pan. Place avocado slices over the chicken and sprinkle cheese. Bake in a preheated 350 degree oven about 15 minutes; or until a fork can be inserted with ease and the cheese is melted. Top the cheese layer with the sour cream. Sprinkle with green onion and red pepper. Garnish with cherry tomatoes and parsley.",https://www.jocooks.com/wp-content/uploads/2015/02/avocado-chicken-salad-1-3-500x500.jpg,,,,6,2
30,"Batter Fried Chicken",2019-11-20,1,1,1,25,"Make better. Dip chicken; drain 5 to 10 minutes on rack. Fill dutch oven 1/3 full of oil; heat to 375 degrees. Cook chicken about 12 minutes. Drain on paper towels.",https://dinnerthendessert.com/wp-content/uploads/2019/01/Fried-Chicken-2-688x1032.jpg,,,,8,3
31,"Catalina Chicken Stir Fry",2019-11-20,1,1,1,22,"Heat dressing; soy sauce and garlic powder in large skillet. Stir in chicken and completely cook; about 8 minutes. Add vegetables and cook; stirring until heated. Serve over cooked rice.",https://diethood.com/wp-content/uploads/2019/09/Zucchini-Mushroom-Chicken-Panda-Express-Copycat-2.jpg,,,,8,3
32,"Chicken Breasts Florentine",2019-11-20,1,1,1,30,"Cook spinach as directed on package; squeeze to drain. Stir in butter; set aside. Place 1 chicken breast; half b1d side up; between 2 pieces of plastic wrap or waxed paper. Working from center; gently pound chicken with rolling pin or flat side of meat mallet until about 1/4 inch thick. Repeat with remaining chicken breast. In small bowl; combine bread crumbs and basil. Coat chicken breasts with crumb mixture. Heat oil over medium-high heat in large skillet. Cook chicken breasts 5 to 7 minutes on each side or until lightly browned and no longer pink. Reduce heat. Spoon cooked spinach evenly over each chicken breast half; sprinkle with cheese. Cover; cook until cheese is melted.",https://iambaker.net/wp-content/uploads/2015/11/ChickenFlorentine1-1280x720.jpg,,,,5,3
33,"Chicken Cashew",2019-11-20,1,1,1,30,"Skin; bone and cut chicken into bit-size pieces. Put chicken in a casserole and cook; covered; until opaque and tender. Stir several times during cooking. Add pea pods (break off ends and remove strings); onions and mushrooms; stir. Cook; covered for 2 minutes. Add bamboo shoots and water chestnuts. Mix chicken bouillon; soy sauce; cornstarch; sugar; pepper; salt. Add to chicken mixture. Stir. Cook covered until the sauce has thickened and the food is well heated. Stir in cashews. Serve with rice. Makes 6 servings.",https://www.oliviascuisine.com/wp-content/uploads/2018/10/asian-chicken-cashews.jpg,,,,8,3
34,"Chicken Lo Mein",2019-11-20,1,1,1,30,"Marinate chicken in mixture of soy sauce; sherry; and cornstarch. Cook chicken in oil in a wok and remove when done. Cook green onions; mushrooms; pea pods; and pepper. Add the bouillon and stir in chicken. Serve over linguini",https://www.thechunkychef.com/wp-content/uploads/2019/01/Easy-Crockpot-Chicken-Lo-Mein-feat.jpg,,,,2,2
35,"Chicken Paprika",2019-11-20,1,1,1,75,"Mix first 8 ingredients in a bag and shake the chicken to coat. Brown the chicken in hot oil. Place in large baking dish. Saute the garlic in oil for 1 minute. Blend in remaining ingredients. Stir and heat. Pour over chicken. Bake uncovered for 1 hour at 325 degrees.",https://reciperunner.com/wp-content/uploads/2018/02/Easy-Smokey-Chicken-Paprikash-Photo.jpg,,,,8,3
36,"In a Hurry Chicken Curry",2019-11-20,1,1,1,30,"Cut chicken into 1 inch cubes. Heat 2 tablespoons of oil over medium-high heat in a large skillet or wok. Add chicken and saute; stirring for about 5 minutes. Remove to side dish. Place remaining tablespoon of oil in the skillet and cook white onion; garlic and green onion until 10der. Stir in curry; ginger and cornstarch. Slowly add chicken broth; stir until smooth. Add broccoli; apple; raisins and cooked chicken. Cover and simmer for 10 minutes. Serve on a bed of rice and garnish with chopped peanuts. Makes 4 servings.",https://parade.com/wp-content/uploads/2010/02/chickencurry_charleshaynes.jpg,,,,8,3
37,"Oven Fried Chicken",2019-11-20,1,1,1,30,"Mix soup; milk; onion; and parley. Dip chicken in this; then into crumbs. Bake at 400 degrees for 1 hour. Drizzle butter over chicken.",https://www.cookingclassy.com/wp-content/uploads/2019/01/oven-fried-chicken-16.jpg,,,,3,6
38,"Parsley and Parmasen Baked Chicken",2019-11-20,1,1,1,60,"Marinate chicken for 4 hours in the dressing. Spoon over and turn occasionally. Drain. Reserve dressing. Combine eggs and water. Mix the rest of the ingredients in a plastic bag. Dip chicken in egg; then in crumbs and return to baking dish. Spoon dressing on top. Bake at 350 degrees for 40 to 50 minutes.",https://www.spendwithpennies.com/wp-content/uploads/2018/11/SpendWithPennies-Chicken-Parmesan-24.jpg,,,,4,3
40,"Saute'd Chicken Breasts",2019-11-20,1,1,1,25,"Brown chicken with paprika. Cook 15 minutes. Remove to warm platter. Cook mushrooms in wine. Add bouillon; 4; and seasonings. Put rice on platter with chicken. Pour mushroom sauce over all.",https://i2.wp.com/www.primaverakitchen.com/wp-content/uploads/2019/03/Garlic-Butter-Baked-Chicken-Breast-Primavera-Kitchen-2.jpg,,,,5,2
41,"Spicy Singapore Wings",2019-11-20,1,1,1,120,"If using wings; remove and discard tips; cut wings into 2 pieces at the joint. Broil chicken 20 to 25 minutes; or deep fat fry at 375 degrees for 10 to 12 minutes. Combine remaining ingredients. Brush sauce on wings or drummettes to coat evenly. Makes 14 to 20 hot appetizers.",https://www.spendwithpennies.com/wp-content/uploads/2014/01/SpendWithPennies-Honey-Garlic-Wings-23.jpg,,,,2,2
42,"Baked Zucchini with Mushrooms",2019-11-20,1,1,1,25,"Thinly sliced mushrooms and chop onion; combine in a 10 to 12 inch frying pan with half a cup of water. Stir often on high heat until liquid evaporates and browned bits stick to pan. To deglaze pan; add 1 third cup of broth and stir browned bits free. Repeat deglazing step until onion is golden brown; 2 or 3 more times; using 1 third cup broth each time. Beat eggs to blend; stir in zucchini crumbs; cheese; oregano; pepper; and mushroom mixture. Pour into a buttered 10 by 12 inch shallow oval casserole (or a 9 by 13 inch rectangle). Bake in a 325 degree oven until set in center when shaken; about 45 minutes top with green onions.",https://jenniferbanz.com/wp-content/uploads/2018/03/One-pan-Chicken-and-Veggies-2.jpg,,,,4,6
43,"Bit O' Zucchini Bites",2019-11-20,1,1,1,25,"In a large skillet cook onion and garlic in butter or margarine until onion is tender but not brown. Add zucchini and stir about 2 minutes or till crisp-tender. Remove from heat. In a bowl mix eggs; cheese; cornmeal; cumin; oregano; and zucchini mixture. Spoon a scant 2 tablespoons of the egg mixture into individual greased 1 and 3 quarter inch muffin pans. Bake at 325 degrees for 15 to eighteen minutes or until set. Remove from pans. Or; pour all the batter into a greased 8 by 8 by 2 inch baking pan. Bake for 20 to 25 minutes or until set. Cut in bite size squares. Serve hot. Makes about 24 appetizers.",https://www.skinnytaste.com/wp-content/uploads/2014/06/Skinnytaste-Zucchini-Tots-550x778.jpg,,,,6,4
44,"Cheesy Spinach Bake",2019-11-20,1,1,1,40,"Combine. Pour into 1 quart dish. Bake at 375 degrees for 25 minutes.",https://k8643br9gv-flywheel.netdna-ssl.com/wp-content/uploads/2013/10/spinach-mozzarella-egg-bake-8-kalynskitchen-1-600x899.jpg,,,,5,6
45,"Crisp Potato Pancakes",2019-11-20,1,1,1,15,"Grate potatoes coarsely. Grate onion. Season with slat and pepper. Add bea10 egg. Form in 2 inch patties. Fry in 1/4 inch of hot oil. Serve with poached egg and salsa or sour cream and chives.",https://www.daringgourmet.com/wp-content/uploads/2017/10/Kartoffelpuffer-11.jpg,,,,1,1
46,"Easy Oven Baked Potatoes",2019-11-20,1,1,1,60,"Cut potatoes and onions into 1/4 inch slices. Layer in baking dish. Combine remaining ingredients. Drizzle over top. Bake at 350 degrees for 40 minutes covered. Uncover and bake 20 minutes more. Makes 8 servings.",https://www.spendwithpennies.com/wp-content/uploads/2015/03/SpendWithPennies-Oven-Roasted-Potatoes-22.jpg,,,,3,6
47,"Green Beans Salerno",2019-11-20,1,1,1,17,"Combine salad oil; vinegar and spaghetti sauce mix. Pour over drained beans. Chill. Before serving; toss beans with shredded lettuce and crumbled bacon.",https://jovinacooksitalian.files.wordpress.com/2014/11/three-bean-pasta-e-fagioli.jpg?w=540,,,,4,2
48,"Mushrooms in Sour Cream",2019-11-20,1,1,1,15,"In skillet; fry bacon until crisp. Drain on paper towel. Add onion and mushrooms. Saute 10 minutes on low heat. Stir in flour. Add cream and worcestershire sauce. Cook on low; stirring constantly. Spoon over toast. Sprinkle bacon on top.",https://shewearsmanyhats.com/wp-content/uploads/2018/10/chicken-breasts-with-creamy-mushroom-sauce-recipe-2.jpg,,,,8,4
49,"Orange Sweet Potatoes",2019-11-20,1,1,1,30,"Peel and cut potatoes into 1/2 inch slices. Put potatoes in a large pot of water; butter and sugar. Boil to fork tender. Do not overcook. Save liquid. Gently remove potatoes and layer in a 9x13 inch baking dish. Top with orange slices. Cook liquid down until syrupy. Pour over potatoes. Sprinkle with cinnamon. Bake at 350 degrees for 30 to 40 minutes;",https://www.dinneratthezoo.com/wp-content/uploads/2018/09/roasted-sweet-potatoes-1.jpg,,,,7,4
50,"Saute Zucchini",2019-11-20,1,1,1,10,"Melt butter in skillet. Slice zucchini thin; Add garlic. Cover and simmer for 5 minutes. Sprinkle with parmesan cheese. Cover and cook 5 minutes longer.",https://hips.hearstapps.com/hmg-prod.s3.amazonaws.com/images/delish-190618-saute-ed-zucchini-015-landscape-pf-1561759338.png,,,,1,3
51,"Stuffed Zucchini",2019-11-20,1,1,1,15,"Cook zucchini to fork tender. Slice lengthwise. Remove center pulp to bowl. Brown hambugrer or sausage with chopped onion. Mix with pulp. Add croutons that have been sof10ed in water boullion cube. Add spices to taste. Stir in 2 eggs. Mixture will be quite soft. Spoon into zucchini shells. Sprinkle with parmesan and melted butter or olive oil. Bake 1/2 hour at 350 degrees until filling is set.",https://www.fifteenspatulas.com/wp-content/uploads/2012/09/Sausage-Stuffed-Zucchini-Fifteen-Spatulas-1-640x959.jpg,,,,1,4
52,"Summer Squash",2019-11-20,1,1,1,20,"Boil squash until tender. Mash with butter; salt; pepper; worcestershire sauce; 2 eggs; cracker crumbs; onion and parmesan cheese. Put in casserole; top with paprika and bacon bits. Bake about 30 minutes.",https://sparkpeo.hs.llnwd.net/e1/resize/630m620/e2/guid/Roasted-Zucchini-and-Yellow-(Summer)-Squash/1e0dc5d2-0f2b-400e-9855-29518177a9fa.jpg,,,,1,4
53,"Sweet and Sour Red Cabbage",2019-11-20,1,1,1,15,"Heat oil in skillet. add cabbage and apple. Combine rest of ingredients; pour over cabbage; Cover tightly. Cook over low heat; sit occasionally for 15-20 minutes; until tender.",https://www.simplyrecipes.com/wp-content/uploads/2006/09/german-red-cabbage-horiz-b-1600.jpg,,,,1,4
54,"Three Cheese Spinach",2019-11-20,1,1,1,20,"Combine onions and mushrooms in small microwave-safe bowl. Microwave 1 to 3 minutes or until onions are soft. Place spinach in 1.5 quart microwave-safe casserole. Cover and microwave 6 to 9 minutes; breaking up and rearranging every 3 minutes; until defrosted. Drain well. Add onion mixture to spinach; along with cottage cheese; parmesan cheese; eggs; salt and pepper. Stir well to blend. Microwave; uncovered; 8 to 11 minutes; rotating dish if necessary every 3 minutes; until misture is headted through and set. Sprinkle grated cheese over top and dust lightly with paprika. Microwave about 1 minute longer to melt cheese. Let stand 3 minutes before serving. Yields 6 to 8 servings.",https://www.verywellfit.com/thmb/1xD-GOWXNQaLmLlAOb8-zVT6q-s=/768x0/filters:no_upscale():max_bytes(150000):strip_icc()/spinachcasserole14-56a5c2cb5f9b58b7d0de5afb.jpg,,,,7,6
55,"Tulelake Potato Casserole",2019-11-20,1,1,1,30,"Thaw potatoes. Mix first 8 ingredients. Put in 9",https://www.tasteofhome.com/wp-content/uploads/2018/02/Ranch-Potato-Casserole_exps2984_CAS2375015A09_08_2bC_RMS-2-696x696.jpg,,,,1,6
56,"Zucchini Patties",2019-11-20,1,1,1,25,"Courslet shred zucchini into a bowl. Press out water. Add rest of ingredients; except oil. Heat oil in skillet. Drop mixture by spoonfuls. Brown on both sides. May also be topped with spaghetti sauce.",https://lifemadesweeter.com/wp-content/uploads/Keto-Zucchini-Fritters-Low-Carb-Recipe-Photo-Picture.jpg,,,,4,4
57,"Artichoke-Mozzarella Casserole",2019-11-20,1,1,1,45,"Heat the olive oil in a small frying pand and saute the onion; garlic; parsley and oregano in it until the onions are soften well. Beat the eggs and stir in the sauteed mixture; the artichoke hearts; bread crumbs; cheese; and salt. Add a dash of hot pepper liquid and stir to mix well. Preheat oven to 350 degrees. Turn into a lightly greased 9-inch square baking dish and bake for about 1/2 hour; or until set. Serves 4 to 6.",https://ketocookingchristian.com/wp-content/uploads/2019/04/IMG_6162-1.jpg,,,,7,6
58,"Asparagus Tomato Quiche",2019-11-20,1,1,1,45,"Preheat oven to 375 degrees. Beat eggs with next 4 ingredients; stir in cheese. Saving 6 asparagus spears for the top; chop the rest into 1",https://www.incredibleegg.org/wp-content/uploads/asparagus-tomato-quiche-930x550.jpg,,,,5,6
59,"Beef Enchiladas",2019-11-20,1,1,1,25,"Saute beef with garlic; salt; vinegar; water; and chili powder. Stir in beans. Set aside. In hot oil in skillet saute garlic and onion until golden. Remove from heat; stir in flour; tomato sauce; vinegar; and hot bouillon. Bring to boil. Add chili powder; salt and pepper. Simmer 5 min. Preheat oven to 350 degrees. Place 1/3 cup filling in center of each tortilla which has been dipped in hot oil or sauce. Roll up; arrange seam down in baking dish. Pour sauce over all. Sprinkle with cheese. Bake about 25 minutes.",https://thecookinchicks.com/wp-content/uploads/2018/04/DSC_0538.jpg,,,,6,3
60,"Broccoli and Rice Casserole",2019-11-20,1,1,1,45,"Cook rice and put in buttered casserole. Boil broccoli according to instructions on the package. Brown onions and celery in butter; add cooked broccoli and soup together. Pour over rice; top with cheese. Can use grated cheddar if you choose. Dot with butter. Put in oven until heated about 10 to 15 minutes at 350 degrees. Can be made ahead of time and frozen. hen frozen; allow to thaw completely then heat about 10 minutes longer.",https://www.thecookierookie.com/wp-content/uploads/2012/11/broccoli-rice-casserole-green-rice-casserole-5-of-9.jpg,,,,5,6
61,"Chili Cheese Puff",2019-11-20,1,1,1,55,"Preheat oven to 350 degrees. In medium size bowl beat eggs until light and lemon colored. Add flour; baking powder; salt; cottage cheese; and jack cheese. Blend until smooth. Stir in chiles. Pour into buttered 9",https://img.buzzfeed.com/video-api-prod/assets/5423b4c783114100b56580b6723f4a4e/BFV21737_ChiliCheeseDogBoats-ThumbA1080.jpg,,,,6,2
62,"Crazy Crust Pizza",2019-11-20,1,1,1,45,"Mix well. Pour into greased and floured pan. Top with 1.5 pounds browned ground beef or sausage; and pepperoni. Add 1 can drained slice mushrooms over top. Bake at 375 degrees for 10 minutes. Add pizza sauce; cheese; etc. Bake 20 minutes more.",https://3.bp.blogspot.com/-Xh-BzpU6jG0/W8c5uIds4-I/AAAAAAADZO8/8F1eK_bTfq86YysDs9zlQOwj02LtX3MdgCLcBGAs/s1600/crazy%2Bcrust%2Bpizza%2Bfont.jpg,,,,3,6
