id,name,date_created,active,creator_id,is_public,prep_time,instructions,photo_link,cookbook,cookbook_page_number,web_link,category_id,type_id
63,"Impossible Taco Pie",2019-11-20,1,1,1,35,"Heat oven to 400 degrees. Grease pie plate; 10 x 1.5”. Cook and stir beef and onion until brown. Beat milk; baking mix and eggs until smoth; 15 seconds in blender on high or 1 minute with hand beater. Pour into plate. Bake 25 minutes. Top with tomatoes and cheese. Bake until knife inserted between center and edge comes out clean; 8 to 10 minutes. Cool 5 minutes. Top with sour cream; tomatoes; lettuce and cheese if desired. Serves 6 to 8.",https://images-gmi-pmc.edge-generalmills.com/199b087b-9929-4809-ae9b-27da07493871.jpg,,,,6,3
64,"Pasta Primavera",2019-11-20,1,1,1,30,"For pesto; in a blender container or food processor bowl. Place fresh basil or parsley; red or green pepper; mayonnaise; parmesan cheese; lemon juice; salt; red pepper and black pepper. Cover; blend or process till pureed. Set aside. In a large amount of boiling salted water cook pasta for 6 minutes. Add carrots and onion. Return to boiling, Drain pasta and vegetables; return to saucepan. Stir in pesto; add chicken to turkey. Toss well to combine. Cook over very low heat for 2 minutes or until heated through; tossing occasionally. Serve immediately. Makes 4 servings.",https://www.cookingclassy.com/wp-content/uploads/2018/09/pasta-primavera-1.jpg,,,,4,2
65,"Sour Cream Enchiladas",2019-11-20,1,1,1,45,"Blend sour cream; onions; cumin; and cheese. Heat tortillas in oil to make them flexible. Put small amount of sauce in bottom of baking dish. Roll filling in tortillas. Place in pan. Put remained of sauce over top. Top with cheese. Bake at 375 degrees for 20 minutes. Make 6 servings. This recipe also works well for chicken enchiladas. Just add two cooked chicken breasts; cut into bite-size pieces.",http://www.dvo.com/newsletter/monthly/2015/may/images/SourCreamEnchiladas.jpg,,,,6,3
66,"Spinach Fritatta",2019-11-20,1,1,1,45,"Wash spinach. Cover and steam 3 to 4 minutes; just until wilted. refresh under cold water; drain and squeeze out all moisture. Chop to 3/4 cup. Set aside. Fry bacon and crumble; set aside. Saute spinach; green onions; garlic; and basil in bacon drippings until soft and tender. Add salt and pepper. Beat eggs with water until frothy; pour over vegetables in skillet. Sprinkle bacon on top. Cook on medium heat until eggs are set. Lift edges of set portion and let uncooked egg flow beneath. Cook until done; about 7 to 8 minutes. Sprinkle with cheese. Place under broiler 2 or 3 minutes until eggs are completely set and cheese is bubbly. Serve with salsa.",https://www.simplyrecipes.com/wp-content/uploads/2006/01/spinach-frittata-horiz-a2-1800.jpg,,,,4,6
67,"Stuffed Green Peppers",2019-11-20,1,1,1,80,"Parboil peppers. Mix all the above. Fill peppers. Place in casserole. Pour tomato sauce over top. Bake 1 hour at 350 degrees.",https://hips.hearstapps.com/hmg-prod/images/delish-classic-stuffed-peppers-horizontal-1538065876.jpg,,,,6,6
68,"Wild Mushroom and Spinach Lasanga",2019-11-20,1,1,1,90,"Cook lasagna noodles according to package intsructions; set aside. Place oil in large; heavy skillet over medium heat. Add garlic and shallots; cook about 5 minutes; until soft. Add mushrooms; cook until liquid is evaporated; about 10 minutes. With slotted spoon; transfer to a large bowl and reserve. Melt butter in skillet; blen in flour and cook for 2 minutes; sturring constantly. Gradually whisk in milk; bring to a simmer. Cook; stirring; until sauce thickens; about 5 minutes. Stir in gorgonzola; 1/2 up parmesan and the tomato paste. Continue cooking and stirring until the cheese is melted. Stir half the mushrooms misture into sauce. Add salt and pepper to taste. remove from heat; reserve. In large mixing bowl; combine spinach; ricotta; 3/4 cup parmesan; eggs; basil; nutmeg; salt and pepper to taste with remaining mushrooms mushroom mixture; stir to blend. (Both sauce and filling can be made a day in advance; covered tightly and refrigerated; reheat before assembling lasagna.) Preheat oven to 375 degrees. Spread a thin layer of sauce on bottom of 2-quart casserole or deep baking dish. Place layer of noodles over sauce. Spoon layer of spinach/mushroom filling over noodles and top with sauce. Repeat layers; ending with noodles and thin layer of sauce. Sprinkle remaining 1/4 cup parmesan over top. Bake about 35 to 40 minutes or until browned and bubbly. If top browns before sauce is bubbly; cover loosely with aluminum foil. Yields 6 to 8 servings.",https://www.littlebroken.com/wp-content/uploads/2017/04/Chicken-Mushroom-and-Spinach-Lasagna-17.jpg,,,,4,6
69,"Big Steak Omelette",2019-11-20,1,1,1,25,"Season the flank steak and grill until medium. .Let it cool and cut into thick slices Over medium high heat, melt butter and add shredded hash browns Season hash browns with salt, pepper, cayenne and paprika. Stir until the hash browns are cooked, about 5 minutes. Remove and set aside In the same pan, saute mushrooms until they cook down, about 2 minutes Remove and set aside Season the egg with salt and pepper to taste and mix with diced green peppers and sweet onions Over medium heat, grease a skillet and pour in the egg mixture Cook until the bottom and edges are solid Add 2/3 of the steak, hash browns, 2/3 of the mushrooms, 1/2 cup Cheddar cheese and 2/3 the tomatoes to one side of the omelette Fold the omelette and continue cooking until the cheese melts Dish and top with leftover steak, mushrooms and tomatoes",https://thecookingjar.com/wp-content/uploads/2014/08/big-steak-omelette-11.jpg,,,,3,1
70,"Good Old Fashioned Pancakes",2019-11-20,1,1,1,15,"In a large bowl, sift together the flour, baking powder, salt and sugar. Make a well in the center and pour in the milk, egg and melted butter; mix until smooth. Heat a lightly oiled griddle or frying pan over medium high heat. Pour or scoop the batter onto the griddle, using approximately 1/4 cup for each pancake. Brown on both sides and serve hot.",https://images.media-allrecipes.com/userphotos/560x315/4948036.jpg,,,,3,1
